{
  "materials": {
    "videos": [
      {
        "id": "mat_img_001",
        "type": "photo",
        "path": "/Users/beye/youtube-co/workspace/episodes/EP-2026-0001/40_assets/images/scene_001.png",
        "width": 1920,
        "height": 1080
      },
      {
        "id": "mat_img_002",
        "type": "photo",
        "path": "/Users/beye/youtube-co/workspace/episodes/EP-2026-0001/40_assets/images/scene_002.png",
        "width": 1920,
        "height": 1080
      },
      {
        "id": "mat_img_003",
        "type": "photo",
        "path": "/Users/beye/youtube-co/workspace/episodes/EP-2026-0001/40_assets/images/scene_003.png",
        "width": 1920,
        "height": 1080
      },
      {
        "id": "mat_img_004",
        "type": "photo",
        "path": "/Users/beye/youtube-co/workspace/episodes/EP-2026-0001/40_assets/images/scene_004.png",
        "width": 1920,
        "height": 1080
      },
      {
        "id": "mat_img_005",
        "type": "photo",
        "path": "/Users/beye/youtube-co/workspace/episodes/EP-2026-0001/40_assets/images/scene_005.png",
        "width": 1920,
        "height": 1080
      },
      {
        "id": "mat_img_006",
        "type": "photo",
        "path": "/Users/beye/youtube-co/workspace/episodes/EP-2026-0001/40_assets/images/scene_006.png",
        "width": 1920,
        "height": 1080
      },
      {
        "id": "mat_img_007",
        "type": "photo",
        "path": "/Users/beye/youtube-co/workspace/episodes/EP-2026-0001/40_assets/images/scene_007.png",
        "width": 1920,
        "height": 1080
      },
      {
        "id": "mat_img_008",
        "type": "photo",
        "path": "/Users/beye/youtube-co/workspace/episodes/EP-2026-0001/40_assets/images/scene_008.png",
        "width": 1920,
        "height": 1080
      },
      {
        "id": "mat_img_009",
        "type": "photo",
        "path": "/Users/beye/youtube-co/workspace/episodes/EP-2026-0001/40_assets/images/scene_009.png",
        "width": 1920,
        "height": 1080
      },
      {
        "id": "mat_img_010",
        "type": "photo",
        "path": "/Users/beye/youtube-co/workspace/episodes/EP-2026-0001/40_assets/images/scene_010.png",
        "width": 1920,
        "height": 1080
      },
      {
        "id": "mat_img_011",
        "type": "photo",
        "path": "/Users/beye/youtube-co/workspace/episodes/EP-2026-0001/40_assets/images/scene_011.png",
        "width": 1920,
        "height": 1080
      },
      {
        "id": "mat_img_012",
        "type": "photo",
        "path": "/Users/beye/youtube-co/workspace/episodes/EP-2026-0001/40_assets/images/scene_012.png",
        "width": 1920,
        "height": 1080
      },
      {
        "id": "mat_img_013",
        "type": "photo",
        "path": "/Users/beye/youtube-co/workspace/episodes/EP-2026-0001/40_assets/images/scene_013.png",
        "width": 1920,
        "height": 1080
      },
      {
        "id": "mat_img_014",
        "type": "photo",
        "path": "/Users/beye/youtube-co/workspace/episodes/EP-2026-0001/40_assets/images/scene_014.png",
        "width": 1920,
        "height": 1080
      },
      {
        "id": "mat_img_015",
        "type": "photo",
        "path": "/Users/beye/youtube-co/workspace/episodes/EP-2026-0001/40_assets/images/scene_015.png",
        "width": 1920,
        "height": 1080
      },
      {
        "id": "mat_img_016",
        "type": "photo",
        "path": "/Users/beye/youtube-co/workspace/episodes/EP-2026-0001/40_assets/images/scene_016.png",
        "width": 1920,
        "height": 1080
      },
      {
        "id": "mat_img_017",
        "type": "photo",
        "path": "/Users/beye/youtube-co/workspace/episodes/EP-2026-0001/40_assets/images/scene_017.png",
        "width": 1920,
        "height": 1080
      },
      {
        "id": "mat_img_018",
        "type": "photo",
        "path": "/Users/beye/youtube-co/workspace/episodes/EP-2026-0001/40_assets/images/scene_018.png",
        "width": 1920,
        "height": 1080
      },
      {
        "id": "mat_img_019",
        "type": "photo",
        "path": "/Users/beye/youtube-co/workspace/episodes/EP-2026-0001/40_assets/images/scene_019.png",
        "width": 1920,
        "height": 1080
      },
      {
        "id": "mat_img_020",
        "type": "photo",
        "path": "/Users/beye/youtube-co/workspace/episodes/EP-2026-0001/40_assets/images/scene_020.png",
        "width": 1920,
        "height": 1080
      },
      {
        "id": "mat_img_021",
        "type": "photo",
        "path": "/Users/beye/youtube-co/workspace/episodes/EP-2026-0001/40_assets/images/scene_021.png",
        "width": 1920,
        "height": 1080
      },
      {
        "id": "mat_img_022",
        "type": "photo",
        "path": "/Users/beye/youtube-co/workspace/episodes/EP-2026-0001/40_assets/images/scene_022.png",
        "width": 1920,
        "height": 1080
      },
      {
        "id": "mat_img_023",
        "type": "photo",
        "path": "/Users/beye/youtube-co/workspace/episodes/EP-2026-0001/40_assets/images/scene_023.png",
        "width": 1920,
        "height": 1080
      },
      {
        "id": "mat_img_024",
        "type": "photo",
        "path": "/Users/beye/youtube-co/workspace/episodes/EP-2026-0001/40_assets/images/scene_024.png",
        "width": 1920,
        "height": 1080
      },
      {
        "id": "mat_img_025",
        "type": "photo",
        "path": "/Users/beye/youtube-co/workspace/episodes/EP-2026-0001/40_assets/images/scene_025.png",
        "width": 1920,
        "height": 1080
      },
      {
        "id": "mat_img_026",
        "type": "photo",
        "path": "/Users/beye/youtube-co/workspace/episodes/EP-2026-0001/40_assets/images/scene_026.png",
        "width": 1920,
        "height": 1080
      },
      {
        "id": "mat_img_027",
        "type": "photo",
        "path": "/Users/beye/youtube-co/workspace/episodes/EP-2026-0001/40_assets/images/scene_027.png",
        "width": 1920,
        "height": 1080
      },
      {
        "id": "mat_img_028",
        "type": "photo",
        "path": "/Users/beye/youtube-co/workspace/episodes/EP-2026-0001/40_assets/images/scene_028.png",
        "width": 1920,
        "height": 1080
      },
      {
        "id": "mat_img_029",
        "type": "photo",
        "path": "/Users/beye/youtube-co/workspace/episodes/EP-2026-0001/40_assets/images/scene_029.png",
        "width": 1920,
        "height": 1080
      },
      {
        "id": "mat_img_030",
        "type": "photo",
        "path": "/Users/beye/youtube-co/workspace/episodes/EP-2026-0001/40_assets/images/scene_030.png",
        "width": 1920,
        "height": 1080
      },
      {
        "id": "mat_img_031",
        "type": "photo",
        "path": "/Users/beye/youtube-co/workspace/episodes/EP-2026-0001/40_assets/images/scene_031.png",
        "width": 1920,
        "height": 1080
      }
    ],
    "audios": [
      {
        "id": "mat_tts_001",
        "type": "audio",
        "path": "/Users/beye/youtube-co/workspace/episodes/EP-2026-0001/40_assets/tts/scene_001.wav",
        "duration": 10000000
      },
      {
        "id": "mat_tts_002",
        "type": "audio",
        "path": "/Users/beye/youtube-co/workspace/episodes/EP-2026-0001/40_assets/tts/scene_002.wav",
        "duration": 12000000
      },
      {
        "id": "mat_tts_003",
        "type": "audio",
        "path": "/Users/beye/youtube-co/workspace/episodes/EP-2026-0001/40_assets/tts/scene_003.wav",
        "duration": 22000000
      },
      {
        "id": "mat_tts_004",
        "type": "audio",
        "path": "/Users/beye/youtube-co/workspace/episodes/EP-2026-0001/40_assets/tts/scene_004.wav",
        "duration": 8000000
      },
      {
        "id": "mat_tts_005",
        "type": "audio",
        "path": "/Users/beye/youtube-co/workspace/episodes/EP-2026-0001/40_assets/tts/scene_005.wav",
        "duration": 16000000
      },
      {
        "id": "mat_tts_006",
        "type": "audio",
        "path": "/Users/beye/youtube-co/workspace/episodes/EP-2026-0001/40_assets/tts/scene_006.wav",
        "duration": 12000000
      },
      {
        "id": "mat_tts_007",
        "type": "audio",
        "path": "/Users/beye/youtube-co/workspace/episodes/EP-2026-0001/40_assets/tts/scene_007.wav",
        "duration": 16000000
      },
      {
        "id": "mat_tts_008",
        "type": "audio",
        "path": "/Users/beye/youtube-co/workspace/episodes/EP-2026-0001/40_assets/tts/scene_008.wav",
        "duration": 14000000
      },
      {
        "id": "mat_tts_009",
        "type": "audio",
        "path": "/Users/beye/youtube-co/workspace/episodes/EP-2026-0001/40_assets/tts/scene_009.wav",
        "duration": 24000000
      },
      {
        "id": "mat_tts_010",
        "type": "audio",
        "path": "/Users/beye/youtube-co/workspace/episodes/EP-2026-0001/40_assets/tts/scene_010.wav",
        "duration": 18000000
      },
      {
        "id": "mat_tts_011",
        "type": "audio",
        "path": "/Users/beye/youtube-co/workspace/episodes/EP-2026-0001/40_assets/tts/scene_011.wav",
        "duration": 20000000
      },
      {
        "id": "mat_tts_012",
        "type": "audio",
        "path": "/Users/beye/youtube-co/workspace/episodes/EP-2026-0001/40_assets/tts/scene_012.wav",
        "duration": 14000000
      },
      {
        "id": "mat_tts_013",
        "type": "audio",
        "path": "/Users/beye/youtube-co/workspace/episodes/EP-2026-0001/40_assets/tts/scene_013.wav",
        "duration": 12000000
      },
      {
        "id": "mat_tts_014",
        "type": "audio",
        "path": "/Users/beye/youtube-co/workspace/episodes/EP-2026-0001/40_assets/tts/scene_014.wav",
        "duration": 14000000
      },
      {
        "id": "mat_tts_015",
        "type": "audio",
        "path": "/Users/beye/youtube-co/workspace/episodes/EP-2026-0001/40_assets/tts/scene_015.wav",
        "duration": 18000000
      },
      {